#,Node,Module,TestFunction,Result,TimeTaken,ExecutedOn,Syslogs,FCLI,TSSH,DCNT,Description,Devices,KnownIssue,Doc
1,gw3,switching/test_vlan.py,,,0:00:40,2024-01-05 02:59:12,0,1,0,2,Module Prolog,"V1, V2",,
2,gw3,switching/test_vlan.py,test_ft_add_unknownvlan_interface,Pass,0:00:09,2024-01-05 02:59:15,0,1,0,2,Test case passed,"V1, V2",,verify that DUT should not assign unknown pvid
3,gw2,switching/test_portchannel.py,,,0:00:48,2024-01-05 02:59:26,0,1,0,2,Module Prolog,"V3, V4",,
4,gw3,switching/test_vlan.py,test_ft_vlan_delete_with_member,Pass,0:00:13,2024-01-05 02:59:27,0,1,0,2,Test case passed,"V1, V2",,Verify that user is not able to delete a valn till its members are deleted
5,gw3,switching/test_vlan.py,test_ft_vlan_trunk_tagged,Pass,0:01:26,2024-01-05 03:00:53,0,1,0,2,Test case passed,"V1, V2",,Verify that over vlan trunk tagged packets received and be sent out with tag or without tag determined by traffic received from TGen.
6,gw2,switching/test_portchannel.py,test_ft_portchannel_with_vlan_variations,Fail,0:01:52,2024-01-05 03:01:08,0,1,0,2,"Portchannel PortChannel7 on V4 with member ['Ethernet48', 'Ethernet52'] verification failed","V3, V4",,"This test case covers below test scenarios/tests FtOpSoSwLagFn041 : Verify that port-channel is up or not when port-channel created followed by add it to VLAN and then making the port-channel up. FtOpSoSwLagFn042 : Verify that port-channel is up when port-channel is created, making the port-channel up and then adding the port-channel to VLAN"
7,gw2,switching/test_portchannel.py,test_ft_verify_min_links_functionality_by_flapping_all_member_ports_007,ConfigFail,0:00:39,2024-01-05 03:01:47,0,1,0,2,pre-test configuration failed Invalid error code PortChannel Verification Failed : unknown message identifier 'PortChannel Verification Failed' @5430,"V3, V4",,
8,gw2,switching/test_portchannel.py,,,0:00:32,2024-01-05 03:02:19,0,1,0,2,Module Epilog,"V3, V4",,
9,gw3,switching/test_vlan.py,test_ft_vlan_save_config_warm_and_fast_reboot,ScriptError,0:05:15,2024-01-05 03:06:07,0,1,0,2,Exception TypeError 'NoneType' object is not subscriptable in file /apis/system/basic.py at line 1389,"V1, V2",,This script covers the below scenarios ft_max_vlan_save_reload	    Verify the save and reload functionality with max vlan configuration. ft_max_vlan_fast_reload	    Verify the max vlan configuration is retained after fast-reboot. FtOpSoSwVlFn026	            Verify that VLAN is present and traffic is not disturbed during and after warm reboot FtOpSoSysFRFn005            Verify the Fast-Reboot must disrupt control plane not more than 90 seconds (from sonic test suite -configuration tests) ft_reboot_fdb_fast_reboot   Verify that the FDB entry is retained after fast reboot.
10,gw2,system/test_lldp.py,,,0:02:14,2024-01-05 03:06:11,0,1,0,2,Module Prolog,"V3, V4",,
11,gw2,system/test_lldp.py,test_ft_lldp_LocManAddrLen,Fail,0:00:00,2024-01-05 03:06:11,0,1,0,2,module configuration failed. LLDP neighbors information is not found after polling @5445,"V3, V4",,Verify that the LocManAddrLen MIB object functions properly. Reference Test Bed : D1 --- Mgmt Network
12,gw2,system/test_lldp.py,test_ft_lldp_LocManAddrlfld,Fail,0:00:00,2024-01-05 03:06:12,0,1,0,2,module configuration failed. LLDP neighbors information is not found after polling @5445,"V3, V4",,Verify that the LocManAddrlfld MIB object functions properly. Reference Test Bed : D1 --- Mgmt Network
13,gw2,system/test_lldp.py,test_ft_lldp_LocManAddrEntry,Fail,0:00:00,2024-01-05 03:06:12,0,1,0,2,module configuration failed. LLDP neighbors information is not found after polling @5445,"V3, V4",,Verify that the LocManAddrEntry MIB object functions properly. Reference Test Bed : D1 --- Mgmt Network
14,gw2,system/test_lldp.py,test_ft_lldp_ConfigManAddrEntry,Fail,0:00:00,2024-01-05 03:06:12,0,1,0,2,module configuration failed. LLDP neighbors information is not found after polling @5445,"V3, V4",,Verify that the ConfigManAddrEntry MIB object functions properly. Reference Test Bed : D1 --- Mgmt Network
15,gw2,system/test_lldp.py,test_ft_lldp_lldplocportid,Fail,0:00:00,2024-01-05 03:06:13,0,1,0,2,module configuration failed. LLDP neighbors information is not found after polling @5445,"V3, V4",,Verify the syntax check of the object lldplocportid. Reference Test Bed : D1 <---> D2
16,gw2,system/test_lldp.py,test_ft_lldp_lldplocsysname,Fail,0:00:00,2024-01-05 03:06:13,0,1,0,2,module configuration failed. LLDP neighbors information is not found after polling @5445,"V3, V4",,Verify the syntax check of the object lldplocsysname. Reference Test Bed : D1 <---> D2
17,gw2,system/test_lldp.py,test_ft_lldp_lldplocsysdesc,Fail,0:00:00,2024-01-05 03:06:14,0,1,0,2,module configuration failed. LLDP neighbors information is not found after polling @5445,"V3, V4",,Verify the syntax check of the object lldplocsysdesc. Reference Test Bed : D1 <---> D2
18,gw2,system/test_lldp.py,test_ft_lldp_rem_man_addr_table,Fail,0:00:00,2024-01-05 03:06:14,0,1,0,2,module configuration failed. LLDP neighbors information is not found after polling @5445,"V3, V4",,Verify the syntax check of the object LLDPRemManAddrTable. Reference Test Bed : D1 <---> D2
19,gw2,system/test_lldp.py,test_ft_lldp_non_default_config,Fail,0:00:00,2024-01-05 03:06:14,0,1,0,2,module configuration failed. LLDP neighbors information is not found after polling @5445,"V3, V4",,Verify non default LLDP neighbor config. Reference Test Bed : D1 <--2--> D2
20,gw2,system/test_lldp.py,test_ft_lldp_docker_restart,Fail,0:00:00,2024-01-05 03:06:15,0,1,0,2,module configuration failed. LLDP neighbors information is not found after polling @5445,"V3, V4",,Verify the LLDP functionality after docker restart. Reference Test Bed : D1 <--2--> D2
21,gw2,system/test_lldp.py,test_lldp_verify_counters,Fail,0:00:00,2024-01-05 03:06:15,0,1,0,2,module configuration failed. LLDP neighbors information is not found after polling @5445,"V3, V4",,Verify LLDP PDUs are not transmitted when the feature is disabled.
22,gw2,system/test_lldp.py,test_ft_lldp_with_remote_server,Fail,0:00:00,2024-01-05 03:06:15,0,1,0,2,module configuration failed. LLDP neighbors information is not found after polling @5445,"V3, V4",,
23,gw2,system/test_lldp.py,,,0:02:20,2024-01-05 03:06:15,0,1,0,2,Module Epilog,"V3, V4",,
24,gw3,switching/test_vlan.py,,,0:00:26,2024-01-05 03:06:33,0,1,0,2,Module Epilog,"V1, V2",,
25,gw2,system/test_interface.py,,,0:01:13,2024-01-05 03:09:39,0,1,0,2,Module Prolog,"V3, V4",,
26,gw2,system/test_interface.py,test_ft_port_fn_verify_shut_noshut,Fail,0:01:17,2024-01-05 03:10:51,0,1,0,2,interface is down on DUT ['Ethernet48'],"V3, V4",,
27,gw2,system/test_interface.py,,,0:00:29,2024-01-05 03:11:19,0,1,0,2,Module Epilog,"V3, V4",,
28,gw3,system/test_ssh.py,,,0:01:42,2024-01-05 03:12:03,0,1,0,2,Module Prolog,"V1, V2",,
29,gw3,system/test_ssh.py,test_ft_ssh_service_disable,Pass,0:00:08,2024-01-05 03:12:05,0,1,0,2,Test case passed,"V1, V2",,
30,gw5,system/test_snapshot.py,,,0:00:53,2024-01-05 03:18:23,0,1,0,1,Module Prolog,V4,,
31,gw5,system/test_snapshot.py,test_ft_watermark_telemetry_interval,Pass,0:00:15,2024-01-05 03:18:33,0,1,0,1,verification of configured telemetry interval and reset to default interval is successful,V4,,
32,gw5,system/test_snapshot.py,,,0:00:32,2024-01-05 03:19:04,0,1,0,1,Module Epilog,V4,,
33,gw4,system/test_snmp.py,,,0:01:43,2024-01-05 03:19:39,0,1,0,1,Module Prolog,V3,,
34,gw4,system/test_snmp.py,test_ft_snmp_sysName,Fail,0:00:06,2024-01-05 03:19:40,0,1,0,1,sysname output is not in sync between system and snmp,V3,,Verify that the sysName MIB object functions properly. Reference Test Bed : D1 --- Mgmt Network
35,gw4,system/test_snmp.py,test_ft_snmp_test_syUpTime,Pass,0:00:06,2024-01-05 03:19:45,0,1,0,1,Test case passed,V3,,Verify that the sysUpTime MIB object functions properly. Reference Test Bed : D1 --- Mgmt Network
36,gw4,system/test_snmp.py,test_ft_snmp_sysDescr,Pass,0:00:08,2024-01-05 03:19:53,0,1,0,1,Test case passed,V3,,Verify that the sysDescr MIB object functions properly. Reference Test Bed : D1 --- Mgmt Network
37,gw4,system/test_snmp.py,test_ft_snmp_mib_2,Pass,0:00:11,2024-01-05 03:20:04,0,1,0,1,Test case passed,V3,,Verify that snmpwalk on mib_2 MIB object functions properly. Reference Test Bed : D1 --- Mgmt Network
38,gw4,system/test_snmp.py,test_ft_snmp_if_mib_all,Pass,0:00:05,2024-01-05 03:20:08,0,1,0,1,Test case passed,V3,,Verify that snmpwalk on if_mib_all MIB object functions properly. Reference Test Bed : D1 --- Mgmt Network
39,gw4,system/test_snmp.py,test_ft_snmp_entity_mib_all,Pass,0:00:05,2024-01-05 03:20:13,0,1,0,1,Test case passed,V3,,Verify that snmpwalk on entity_mib_all MIB object functions properly. Reference Test Bed : D1 --- Mgmt Network
40,gw4,system/test_snmp.py,test_ft_snmp_dot1q_dot1db_mib,Pass,0:00:05,2024-01-05 03:20:18,0,1,0,1,Test case passed,V3,,Verify that snmpwalk on dot1q MIB object functions properly. Reference Test Bed : D1 --- Mgmt Network
41,gw4,system/test_snmp.py,test_ft_snmp_root_node_walk,Pass,0:00:17,2024-01-05 03:20:34,0,1,0,1,Test case passed,V3,,Verify that snmpwalk on entity_sensor_mib MIB object functions properly. Reference Test Bed : D1 --- Mgmt Network
42,gw4,system/test_snmp.py,test_ft_snmp_ipAddressRowStatus_ipv6,Pass,0:00:11,2024-01-05 03:20:44,0,1,0,1,Test case passed,V3,,Verify that snmpwalk on IP-MIB::ipAddressRowStatus.ipv6 MIB object functions properly. Reference Test Bed : D1 --- Mgmt Network
43,gw4,system/test_snmp.py,test_ft_snmp_ipAddressStorageType_ipv6,Pass,0:00:05,2024-01-05 03:20:49,0,1,0,1,Test case passed,V3,,Verify that snmpwalk on IP-MIB::ipAddressStorageType.ipv6 MIB object functions properly. Reference Test Bed : D1 --- Mgmt Network
44,gw4,system/test_snmp.py,test_ft_snmp_ipv6_If_Forward_default_HopLimit,Pass,0:00:05,2024-01-05 03:20:54,0,1,0,1,Test case passed,V3,,Verify that snmpwalk on  ipv6IpForwarding and ipv6IpDefaultHopLimit MIB object functions properly. Reference Test Bed : D1 --- Mgmt Network
45,gw4,system/test_snmp.py,test_ft_snmp_ipv6scope_index_table,Pass,0:00:05,2024-01-05 03:20:58,0,1,0,1,Test case passed,V3,,Verify that snmpwalk on ipv6ScopeZoneIndexTable MIB object functions properly. Reference Test Bed : D1 --- Mgmt Network
46,gw4,system/test_snmp.py,test_ft_snmp_ip_forward_table,Pass,0:00:08,2024-01-05 03:21:05,0,1,0,1,Test case passed,V3,,Verify that snmpwalk walk on ipForwardTable MIB functions properly Reference Test Bed : D1 --- Mgmt Network
47,gw4,system/test_snmp.py,test_ft_snmp_ifx_table,Pass,0:00:06,2024-01-05 03:21:11,0,1,0,1,Test case passed,V3,,Verify snmpwalk for ifXTable Object gives list of interface entries on the switch. Reference Test Bed : D1 --- Mgmt Network
48,gw3,system/test_ssh.py,test_ft_ssh_add_user_verify,Fail,0:09:09,2024-01-05 03:21:14,0,1,0,2,Test case Failed.,"V1, V2",,
49,gw4,system/test_snmp.py,test_ft_snmp_ip_System_Stats_Table,Pass,0:00:05,2024-01-05 03:21:16,0,1,0,1,Test case passed,V3,,"Verify snmpwalk for ipSystemStatsTable Object gives the table containing system wide, IP version specific traffic statistics. Reference Test Bed : D1 --- Mgmt Network"
50,gw4,system/test_snmp.py,test_ft_snmp_ip_IfStats_Table,Pass,0:00:05,2024-01-05 03:21:20,0,1,0,1,Test case passed,V3,,Verify snmpwalk for ipIfStatsTable Object gives the table containing per-interface traffic statistics. Reference Test Bed : D1 --- Mgmt Network
51,gw4,system/test_snmp.py,test_ft_snmp_ip_Address_Table,Pass,0:00:05,2024-01-05 03:21:25,0,1,0,1,Test case passed,V3,,Verify snmpwalk for ipAddressTable Object gives table contains addressing information relevant to the entity's interfaces. Reference Test Bed : D1 --- Mgmt Network
52,gw4,system/test_snmp.py,test_ft_snmp_ip_NetToPhysical_Table,Pass,0:00:05,2024-01-05 03:21:30,0,1,0,1,Test case passed,V3,,Verify snmpwalk for ipNetToPhysicalTable Object gives each entry contains one IP address to physical address equivalence. Reference Test Bed : D1 --- Mgmt Network
53,gw4,system/test_snmp.py,test_ft_snmp_icmp_Msgs,Pass,0:00:05,2024-01-05 03:21:34,0,1,0,1,Test case passed,V3,,Verify snmpwalk for icmpMsgs Object gives Internet Control Message Protocol related information. Reference Test Bed : D1 --- Mgmt Network
54,gw3,system/test_ssh.py,test_ft_verify_logs_at_the_time_of_ssh_login_success,Pass,0:00:22,2024-01-05 03:21:36,0,1,0,2,Test case passed,"V1, V2",,"ceta-sonic-67575: Verify that on successful ssh login, error logs are generated"
55,gw4,system/test_snmp.py,test_ft_snmp_tcp_mib,Pass,0:00:20,2024-01-05 03:21:54,0,1,0,1,Test case passed,V3,,Verify snmpwalk for TCP-MIB Object gives Transmission Control Protocol related information. Reference Test Bed : D1 --- Mgmt Network
56,gw4,system/test_snmp.py,test_ft_snmp_udp_mib,Pass,0:00:05,2024-01-05 03:21:59,0,1,0,1,Test case passed,V3,,Verify snmpwalk for UDP-MIB Object gives User Datagram Protocol related information. Reference Test Bed : D1 --- Mgmt Network
57,gw4,system/test_snmp.py,test_ft_snmp_snmpv2_mib,Pass,0:00:05,2024-01-05 03:22:03,0,1,0,1,Test case passed,V3,,Verify snmpwalk for SNMPv2-MIB Object gives system SNMP variables. Reference Test Bed : D1 --- Mgmt Network
58,gw5,system/test_ntp.py,,,0:00:54,2024-01-05 03:22:04,0,1,0,1,Module Prolog,V4,,
59,gw4,system/test_snmp.py,test_ft_snmp_host_resource_mib,Pass,0:00:05,2024-01-05 03:22:08,0,1,0,1,Test case passed,V3,,Verify snmpwalk for HOST-RESOURCES-MIB Object gives a uniform set of objects useful for the management of host computers. Reference Test Bed : D1 --- Mgmt Network
60,gw4,system/test_snmp.py,test_ft_snmp_framework_mib,Pass,0:00:05,2024-01-05 03:22:13,0,1,0,1,Test case passed,V3,,Verify snmpwalk for SNMP-FRAMEWORK-MIB Object gives The SNMP Management Architecture information. Reference Test Bed : D1 --- Mgmt Network
61,gw4,system/test_snmp.py,test_ft_snmp_mpd_mib,Pass,0:00:05,2024-01-05 03:22:17,0,1,0,1,Test case passed,V3,,Verify snmpwalk for SNMP-MPD-MIB Object gives the compliance statement for SNMP entities which implement the SNMP-MPD-MIB. Reference Test Bed : D1 --- Mgmt Network
62,gw4,system/test_snmp.py,test_ft_snmp_target_mib,Pass,0:00:05,2024-01-05 03:22:22,0,1,0,1,Test case passed,V3,,Verify snmpwalk for SNMP-TARGET-MIB Object it defines MIB objects which provide mechanisms to remotely configure the parameters. Reference Test Bed : D1 --- Mgmt Network
63,gw4,system/test_snmp.py,test_ft_snmp_notification_mib,Pass,0:00:05,2024-01-05 03:22:26,0,1,0,1,Test case passed,V3,,Verify snmpwalk for SNMP-NOTIFICATION-MIB Object defines MIB objects which provide mechanisms to remotely configure the parameters. Reference Test Bed : D1 --- Mgmt Network
64,gw3,system/test_ssh.py,,,0:00:52,2024-01-05 03:22:28,0,1,0,2,Module Epilog,"V1, V2",,
65,gw4,system/test_snmp.py,test_ft_snmp_user_based_sm_mib,Pass,0:00:05,2024-01-05 03:22:31,0,1,0,1,Test case passed,V3,,Verify snmpwalk for SNMP-USER-BASED-SM-MIB Object gives the management information definitions for the SNMP User-based Security Model. Reference Test Bed : D1 --- Mgmt Network
66,gw4,system/test_snmp.py,test_ft_snmp_view_based_acm_mib,Pass,0:00:05,2024-01-05 03:22:36,0,1,0,1,Test case passed,V3,,Verify snmpwalk for SNMP-VIEW-BASED-ACM-MIB Object gives the management information definitions for the View-based Access Control Model for SNMP. Reference Test Bed : D1 --- Mgmt Network
67,gw4,system/test_snmp.py,test_ft_snmp_ent_physical_table,Pass,0:00:05,2024-01-05 03:22:40,0,1,0,1,Test case passed,V3,,Verify snmpwalk for entPhysicalTableObject gives the Information about a particular physical entity. Reference Test Bed : D1 --- Mgmt Network
68,gw4,system/test_snmp.py,test_ft_snmp_dot3_stats_table,Pass,0:00:05,2024-01-05 03:22:45,0,1,0,1,Test case passed,V3,,Verify snmpwalk for dot3StatsTable gives Statistics for a collection of ethernet-like interfaces attached to a particular system. Reference Test Bed : D1 --- Mgmt Network
69,gw4,system/test_snmp.py,test_ft_net_snmp_agent_mib,Pass,0:00:05,2024-01-05 03:22:50,0,1,0,1,Test case passed,V3,,*Verify snmpwalk for NET-SNMP-AGENT-MIB is successfull. Reference Test Bed : D1 --- Mgmt Network
70,gw4,system/test_snmp.py,test_ft_net_snmp_vacm_mib,Pass,0:00:05,2024-01-05 03:22:54,0,1,0,1,Test case passed,V3,,*Verify snmpwalk for NET-SNMP-VACM-MIB defines Net-SNMP extensions to the standard VACM view table. Reference Test Bed : D1 --- Mgmt Network
71,gw4,system/test_snmp.py,test_ft_snmp_ucd_diskio_mib,Pass,0:00:05,2024-01-05 03:22:59,0,1,0,1,Test case passed,V3,,*Verify snmpwalk for UCD-DISKIO-MIB defines objects for disk IO statistics. Reference Test Bed : D1 --- Mgmt Network
72,gw4,system/test_snmp.py,test_ft_snmp_ucd_la_table,Pass,0:00:05,2024-01-05 03:23:03,0,1,0,1,Test case passed,V3,,"*Verify snmpwalk for UCD-LaTable-MIB it gives the 1,5 and 15 minute load averages. Reference Test Bed : D1 --- Mgmt Network"
73,gw4,system/test_snmp.py,test_ft_snmp_ucd_system_stats,Pass,0:00:05,2024-01-05 03:23:08,0,1,0,1,Test case passed,V3,,*Verify snmpwalk for UCD-SystemStats-MIB it gives the CPU related information. Reference Test Bed : D1 --- Mgmt Network
74,gw4,system/test_snmp.py,test_ft_snmp_dot1q_tp_fdb_port,Fail,0:00:07,2024-01-05 03:23:14,0,1,0,1,SNMP output is not found after walk of dot1qTpFdbPort OID,V3,,Verify that the dot1qTpFdbPort Object functions properly. Reference Test Bed : D1 --- Mgmt Network
75,gw4,system/test_snmp.py,test_ft_snmp_dot1q_tp_fdb_address,Pass,0:00:05,2024-01-05 03:23:19,0,1,0,1,Test case passed,V3,,Verify that the dot1qTpFdbAddress Object functions properly.
76,gw4,system/test_snmp.py,test_ft_snmp_coldstart_trap,EnvFail,0:00:19,2024-01-05 03:23:38,0,1,0,1,Test case Failed Couldn't get the snmptrapd process details from snmp trap server. Please check the snmp trap server process in the server.,V3,,Verify that trap is sent when rps reboot is performed.
77,gw4,system/test_snmp.py,test_ft_snmp_docker_restart,Fail,0:00:17,2024-01-05 03:23:54,0,1,0,1,sysname output is not in sync between system and snmp after docker restart,V3,,Verify that the sysName MIB object functions properly after docker restart Reference Test Bed : D1--- Mgmt Network
78,gw4,system/test_snmp.py,,,0:00:53,2024-01-05 03:24:47,0,1,0,1,Module Epilog,V3,,
79,gw5,system/test_ntp.py,test_ft_ntp_disable_enable_with_message_log,Pass,0:05:07,2024-01-05 03:27:06,0,1,0,1,Test case passed,V4,,Referrence Topology : 	Test bed ID:4 D1--Mgmt network Verify that Ntp synchronization is successful after doing NTP server on and off  and the message log display the correct time based upon the system up time.
80,gw5,system/test_ntp.py,test_ntp_exists_config,Pass,0:00:12,2024-01-05 03:27:18,0,1,0,1,Test case passed,V4,,
81,gw5,system/test_ntp.py,,,0:00:27,2024-01-05 03:27:44,0,1,0,1,Module Epilog,V4,,
82,gw4,security/test_tacacs.py,,,0:02:49,2024-01-05 03:29:46,0,1,0,1,Module Prolog,V3,,
83,gw4,security/test_tacacs.py,test_ft_tacacs_ssh_login_with_tacacs_operations,Fail,0:00:06,2024-01-05 03:29:47,0,1,0,1,PAM file is not created,V3,,"This testcase covers the below scenarios scenario-1: Verify default login via tacacs is successful. scenario-2: Verify that by default, no TACACS servers exist and that a single TACACS server can be added and used for authentication scenario-3: Verify that SSH login using Cisco ACS TACACS+ Server is successful. Scenario-4: Verify If TACACS+ Authentication is enabled, a new PAM configuration file ?common-auth-sonic? is created. Scenario-5: Verify that user is able to execute the ?TACACS-server key command successfully in appropriate mode. Scenario-6: Verify that authentication to a TACACS server will only take place if the NAS and the server are configured with the same shared key"
84,gw4,security/test_tacacs.py,,,0:00:39,2024-01-05 03:30:25,0,1,0,1,Module Epilog,V3,,
